{"schema":"continuityos.memory_promotion.semantic_decisions/v1","closure_receipt_sha256":"bbbbbbbbbbbbbbbbbbbbbbbbbbbbbbbbbbbbbbbbbbbbbbbbbbbbbbbbbbbbbbbb","authority_generation":"R63","memory_candidate_authority":"NON_AUTHORITATIVE_CANDIDATE","promotion_decision":"HOLD","human_irreversible_approval":false,"global_gates":{},"slots":[],"self_application":false}
